{
  "$schema": "https://json-schema.org/draft/2020-12/schema",
  "$id": "urn:elad:schema:evidence-manifest:0.5",
  "title": "Evidence Manifest",
  "type": "object",
  "additionalProperties": false,
  "required": [
    "schemaVersion",
    "manifestId",
    "state",
    "protocolBundle",
    "subject",
    "framing",
    "outerEnvelopeRequired",
    "entries",
    "createdAt",
    "supersedes"
  ],
  "properties": {
    "schemaVersion": { "const": "0.5" },
    "manifestId": { "type": "string", "pattern": "^evidence-manifest:[a-z0-9][a-z0-9._-]*$" },
    "state": { "enum": ["template_inert", "draft", "sealed", "superseded"] },
    "protocolBundle": { "$ref": "#/$defs/immutableReference" },
    "subject": {
      "type": "object",
      "additionalProperties": false,
      "required": ["kind", "repositoryId", "id", "sha256", "baseHead"],
      "properties": {
        "kind": { "enum": ["candidate", "target_artifact", "runtime", "evaluation"] },
        "repositoryId": { "type": "string", "pattern": "^repo:[a-z0-9][a-z0-9._-]*$" },
        "id": { "type": "string", "minLength": 1 },
        "sha256": { "$ref": "#/$defs/sha256" },
        "baseHead": { "type": ["string", "null"], "pattern": "^[a-f0-9]{40,64}$" }
      }
    },
    "framing": { "const": "elad-canonical-json-outer-sha256-v1" },
    "outerEnvelopeRequired": { "const": true },
    "entries": {
      "type": "array",
      "items": {
        "type": "object",
        "additionalProperties": false,
        "required": ["evidenceId", "path", "bytes", "sha256", "role", "evidenceClass", "resolvedSubject", "claimIds"],
        "properties": {
          "evidenceId": { "type": "string", "pattern": "^evidence:[a-z0-9][a-z0-9._-]*$" },
          "path": { "$ref": "#/$defs/repositoryPath" },
          "bytes": { "type": "integer", "minimum": 0 },
          "sha256": { "$ref": "#/$defs/sha256" },
          "role": { "type": "string", "minLength": 1 },
          "evidenceClass": { "type": "string", "minLength": 1 },
          "resolvedSubject": { "$ref": "#/$defs/resolvedSubject" },
          "claimIds": { "type": "array", "items": { "type": "string", "pattern": "^claim:[a-z0-9][a-z0-9._-]*$" }, "uniqueItems": true, "minItems": 1 }
        }
      }
    },
    "createdAt": { "type": ["string", "null"], "format": "date-time" },
    "supersedes": { "$ref": "#/$defs/optionalImmutableReference" }
  },
  "$defs": {
    "sha256": { "type": "string", "pattern": "^[A-F0-9]{64}$" },
    "repositoryPath": {
      "type": "string",
      "minLength": 1,
      "pattern": "^(?!/)(?!.*\\\\)(?!.*(?:^|/)\\.{1,2}(?:/|$))(?!.*//)(?!.*:)(?!.*[. ](?:/|$))(?!.*(?:^|/)(?:[Cc][Oo][Nn]|[Pp][Rr][Nn]|[Aa][Uu][Xx]|[Nn][Uu][Ll]|[Cc][Ll][Oo][Cc][Kk]\\$|[Cc][Oo][Nn][Ii][Nn]\\$|[Cc][Oo][Nn][Oo][Uu][Tt]\\$|[Cc][Oo][Mm][1-9¹²³]|[Ll][Pp][Tt][1-9¹²³])(?:\\.[^/]*)?(?:/|$))[^/\\x00-\\x1F<>\"|?*]+(?:/[^/\\x00-\\x1F<>\"|?*]+)*$"
    },
    "immutableReference": {
      "type": "object",
      "additionalProperties": false,
      "required": ["id", "path", "sha256", "schemaVersion"],
      "properties": {
        "id": { "type": "string", "pattern": "^[a-z][a-z0-9-]*:[a-z0-9][a-z0-9._-]*$" },
        "path": { "$ref": "#/$defs/repositoryPath" },
        "sha256": { "$ref": "#/$defs/sha256" },
        "schemaVersion": { "type": "string", "pattern": "^(0|[1-9][0-9]*)\\.(0|[1-9][0-9]*)$" }
      }
    },
    "optionalImmutableReference": {
      "type": ["object", "null"],
      "additionalProperties": false,
      "required": ["id", "path", "sha256", "schemaVersion"],
      "properties": {
        "id": { "type": "string", "pattern": "^evidence-manifest:[a-z0-9][a-z0-9._-]*$" },
        "path": { "$ref": "#/$defs/repositoryPath" },
        "sha256": { "$ref": "#/$defs/sha256" },
        "schemaVersion": { "type": "string", "pattern": "^(0|[1-9][0-9]*)\\.(0|[1-9][0-9]*)$" }
      }
    },
    "resolvedSubject": {
      "type": "object",
      "additionalProperties": false,
      "required": ["kind", "repositoryId", "id", "baseHead", "sha256"],
      "properties": {
        "kind": { "type": "string", "minLength": 1 },
        "repositoryId": { "type": "string", "pattern": "^repo:[a-z0-9][a-z0-9._-]*$" },
        "id": { "type": "string", "minLength": 1 },
        "baseHead": { "type": "string", "pattern": "^[a-f0-9]{40,64}$" },
        "sha256": { "$ref": "#/$defs/sha256" }
      }
    }
  }
}
