{
  "schemaVersion": "0.5",
  "manifestId": "evidence-manifest:example_read_only_review",
  "state": "template_inert",
  "protocolBundle": {
    "id": "protocol:elad_0.5",
    "path": "blueprint.json",
    "sha256": "DDDDDDDDDDDDDDDDDDDDDDDDDDDDDDDDDDDDDDDDDDDDDDDDDDDDDDDDDDDDDDDD",
    "schemaVersion": "0.5"
  },
  "subject": {
    "kind": "candidate",
    "repositoryId": "repo:example_project",
    "id": "candidate:example_read_only_review",
    "sha256": "6666666666666666666666666666666666666666666666666666666666666666",
    "baseHead": "aaaaaaaaaaaaaaaaaaaaaaaaaaaaaaaaaaaaaaaa"
  },
  "framing": "elad-canonical-json-outer-sha256-v1",
  "outerEnvelopeRequired": true,
  "entries": [],
  "createdAt": null,
  "supersedes": null
}
